{
  "$schema": "https://json-schema.org/draft/2020-12/schema",
  "$id": "https://gigagit.dev/specs/gg-notes-store/review-document.lenient.schema.json",
  "title": "gg review document (reader's lenient form)",
  "description": "The shape a READER validates with: required fields, types and the closed display vocabularies as the strict schema, unknown keys tolerated (spec part 1 §8.3). Length limits are code points; gg enforces BYTES after trimming. A range's first <= last is not expressible in JSON Schema: gg's parser enforces it; a reader checks it itself.",
  "$defs": {
    "meta": {
      "type": "object",
      "additionalProperties": {
        "type": "string"
      }
    },
    "displayValue": {
      "type": "object",
      "additionalProperties": true,
      "properties": {
        "color": {
          "enum": [
            "red",
            "orange",
            "yellow",
            "green",
            "blue",
            "purple",
            "grey"
          ]
        },
        "glyph": {
          "type": "string",
          "pattern": "^([!-~]|[◆·→»•])$"
        },
        "level": {
          "enum": [
            "high",
            "medium",
            "low",
            "info"
          ]
        },
        "audience": {
          "enum": [
            "author",
            "reviewer"
          ]
        }
      }
    },
    "display": {
      "type": "object",
      "maxProperties": 8,
      "additionalProperties": {
        "type": "object",
        "additionalProperties": true,
        "properties": {
          "show": {
            "type": "array",
            "items": {
              "enum": [
                "badge",
                "frame",
                "count",
                "line"
              ]
            }
          },
          "label": {
            "type": "string"
          },
          "order": {
            "type": "integer"
          },
          "style": {
            "enum": [
              "filled",
              "text"
            ]
          },
          "as": {
            "enum": [
              "level",
              "audience"
            ]
          },
          "values": {
            "type": "object",
            "maxProperties": 16,
            "additionalProperties": {
              "$ref": "#/$defs/displayValue"
            }
          },
          "other": {
            "$ref": "#/$defs/displayValue"
          }
        }
      }
    },
    "range": {
      "type": "array",
      "items": {
        "type": "integer",
        "minimum": 1
      },
      "minItems": 2,
      "maxItems": 2
    },
    "annotation": {
      "type": "object",
      "additionalProperties": true,
      "required": [
        "summary"
      ],
      "oneOf": [
        {
          "required": [
            "newRange"
          ]
        },
        {
          "required": [
            "oldRange"
          ]
        }
      ],
      "properties": {
        "newRange": {
          "$ref": "#/$defs/range"
        },
        "oldRange": {
          "$ref": "#/$defs/range"
        },
        "summary": {
          "type": "string",
          "minLength": 1
        },
        "rationale": {
          "type": "string"
        },
        "meta": {
          "$ref": "#/$defs/meta"
        },
        "display": {
          "$ref": "#/$defs/display"
        }
      }
    },
    "file": {
      "type": "object",
      "additionalProperties": true,
      "required": [
        "path"
      ],
      "properties": {
        "path": {
          "type": "string",
          "minLength": 1
        },
        "summary": {
          "type": "string"
        },
        "meta": {
          "$ref": "#/$defs/meta"
        },
        "display": {
          "$ref": "#/$defs/display"
        },
        "annotations": {
          "type": "array",
          "items": {
            "$ref": "#/$defs/annotation"
          }
        }
      }
    }
  },
  "type": "object",
  "additionalProperties": true,
  "required": [
    "version",
    "summary"
  ],
  "properties": {
    "version": {
      "const": 1
    },
    "summary": {
      "type": "string",
      "minLength": 1
    },
    "overview": {
      "type": "string",
      "minLength": 1,
      "maxLength": 65536
    },
    "meta": {
      "$ref": "#/$defs/meta"
    },
    "display": {
      "$ref": "#/$defs/display"
    },
    "files": {
      "type": "array",
      "items": {
        "$ref": "#/$defs/file"
      }
    }
  }
}
